{
  "id": "EVAL-TPRM-006",
  "task": "Assess a strong control design with weak operational evidence.",
  "context": "Policy requires quarterly access reviews with manager approval. The vendor supplies the policy but no completed review, ticket, exception record, or sample removal.",
  "evidence": ["Access review policy"],
  "expectedExpertConsiderations": ["Design versus operation", "Review population", "Completion", "Exceptions", "Timely removal"],
  "likelyNoviceMistake": "Closing the control because the policy language is strong.",
  "relevantHeuristics": ["compensating_controls.demonstrated_bundle"],
  "requiredConcepts": ["operation", "evidence", "sample", "completion", "uncertainty"],
  "forbiddenClaims": ["the policy proves reviews occur"],
  "rubric": ["Separates design from operation", "Requests a representative artifact", "Does not infer failure from missing evidence"]
}
