{
  "id": "EVAL-TPRM-004",
  "task": "Recommend next action for a critical vendor with weak evidence.",
  "context": "A sole-source payroll vendor says controls are industry standard but supplies no report, configuration, test result, or contractual commitment.",
  "evidence": ["Vendor assertion only", "Business criticality record"],
  "expectedExpertConsiderations": ["Concentration", "Operational dependency", "Evidence confidence", "Contract leverage", "Contingency"],
  "likelyNoviceMistake": "Confusing vendor criticality with proof that the controls are weak, or accepting the assertion because replacement is difficult.",
  "relevantHeuristics": ["compensating_controls.demonstrated_bundle"],
  "requiredConcepts": ["criticality", "evidence", "dependency", "uncertainty", "contingency"],
  "forbiddenClaims": ["the vendor definitely lacks controls"],
  "rubric": ["Separates risk from evidence confidence", "Accounts for business dependency", "Names a practical next step"]
}
