{
  "id": "EVAL-TPRM-003",
  "task": "Assess the materiality of missing MFA.",
  "context": "A disposable test environment has no production data, no customer access, and local accounts without MFA. It is rebuilt weekly.",
  "evidence": ["Architecture statement", "Environment inventory"],
  "expectedExpertConsiderations": ["Exposure", "Data sensitivity", "Connectivity", "Reversibility", "Alternative controls"],
  "likelyNoviceMistake": "Assigning high risk from the missing control without analyzing consequence.",
  "relevantHeuristics": ["materiality.gap_vs_consequence"],
  "requiredConcepts": ["exposure", "reversibility", "materiality", "connectivity"],
  "forbiddenClaims": ["missing mfa is always high risk"],
  "rubric": ["Recognizes the gap", "Assesses consequence", "Avoids automatic escalation"]
}
