{
  "id": "EVAL-RISK-001",
  "task": "Review a risk register entry for decision usefulness.",
  "context": "Risk: Cyberattack may occur due to inadequate security, causing business impact. Rating: High.",
  "evidence": ["Risk register entry"],
  "expectedExpertConsiderations": ["Asset or process", "Threat actor or event", "Loss pathway", "Affected stakeholder", "Magnitude and frequency uncertainty"],
  "likelyNoviceMistake": "Polishing the wording without making the scenario more analyzable.",
  "relevantHeuristics": [],
  "requiredConcepts": ["asset", "event", "consequence", "uncertainty"],
  "forbiddenClaims": ["high rating is validated"],
  "rubric": ["Identifies missing scenario elements", "Does not invent a threat", "Produces useful follow-up questions"]
}
